{
  "protocolVersion": 1,
  "requestId": "00000000-0000-4000-8000-000000000001",
  "method": "command.apply",
  "projectId": "00000000-0000-4000-8000-000000000002",
  "expectedRevision": 4,
  "payload": {
    "commandType": "MoveNodeCommand",
    "arguments": {
      "pathId": "00000000-0000-4000-8000-000000000003",
      "nodeId": "00000000-0000-4000-8000-000000000004",
      "positionMm": {
        "x": 100,
        "y": 200
      }
    }
  }
}
